{
  "schemaVersion": "1.0.0",
  "kind": "captured",
  "fidelity": "per-request",
  "recordId": "e75ca2a89dde14dbf6049458a4776171d80aa5dc18372be7f193c13626b4c0bb",
  "idempotencyKey": "attr-branch-iii-key",
  "provenance": {
    "cli": "claude-code",
    "cliVersion": "2.1.4",
    "captureChannel": "own-record-tail",
    "formatFingerprint": "sha256:00000000000000000000000000000000"
  },
  "identity": {
    "sessionId": "attr-branch-iii-session",
    "parentSessionId": null,
    "agentId": null,
    "projectRoot": "unknown"
  },
  "timing": {
    "requestInstant": "2026-05-02T09:10:00.000Z",
    "captureInstant": "2026-05-02T09:10:00.000Z"
  },
  "modelId": "claude-sonnet-5",
  "interaction": "user-turn",
  "tokens": {
    "netInput": 100,
    "cacheRead": 0,
    "cacheWrite": 0,
    "output": 50,
    "reasoning": 0
  },
  "raw": {
    "vendor": "test-fixture",
    "usage": {
      "input_tokens": 100,
      "output_tokens": 50
    }
  },
  "rawStatus": "complete"
}
