{
  "schemaVersion": "1.0.0",
  "kind": "captured",
  "fidelity": "per-request",
  "recordId": "c4ba525904de0df1a56e2c6e1995cfe34abddda33048b8747085ec5009c897ee",
  "idempotencyKey": "r20-ny-2027-01-01",
  "provenance": {
    "cli": "claude-code",
    "cliVersion": "1.0.0",
    "captureChannel": "test-fixture",
    "formatFingerprint": "sha256:00000000000000000000000000000000"
  },
  "identity": {
    "sessionId": "sess-ny",
    "parentSessionId": null,
    "agentId": null,
    "projectRoot": "/home/agent/SENTINEL-PROJECT-ROOT-51d2"
  },
  "timing": {
    "requestInstant": "2027-01-01T02:00:00.000Z",
    "captureInstant": "2027-01-01T02:00:00.000Z"
  },
  "modelId": "claude-sonnet-5",
  "interaction": "user-turn",
  "tokens": {
    "netInput": 20,
    "cacheRead": 0,
    "cacheWrite": 0,
    "output": 2,
    "reasoning": 0
  },
  "raw": {
    "vendor": "test-fixture",
    "usage": {},
    "transcriptExcerpt": "SENTINEL-CONVERSATION-TEXT-7f3a9c"
  },
  "rawStatus": "complete"
}
