{
  "schemaVersion": "1.0.0",
  "kind": "captured",
  "fidelity": "per-request",
  "recordId": "925cc42beb8aa7f6f6afa8117ade221e26d1b99966062502c1b7898c9cf2d502",
  "idempotencyKey": "mutant-externalized-without-ref-001",
  "provenance": {
    "cli": "claude-code",
    "cliVersion": "2.1.4",
    "captureChannel": "own-record-tail",
    "formatFingerprint": "sha256:9f1c2b7e4a5d6f809c1b2e3a4d5f6081"
  },
  "identity": {
    "sessionId": "mutant-session-externalized-without-ref",
    "parentSessionId": null,
    "agentId": null,
    "projectRoot": "/home/agent/workspaces/crewrig"
  },
  "timing": {
    "requestInstant": "2026-09-16T09:12:03.221Z",
    "captureInstant": "2026-09-16T09:12:04.884Z"
  },
  "modelId": "claude-sonnet-5",
  "interaction": "user-turn",
  "tokens": {
    "netInput": 100,
    "cacheRead": 0,
    "cacheWrite": 0,
    "output": 50,
    "reasoning": 0
  },
  "rawStatus": "externalized"
}
