{
  "schemaVersion": "1.0.0",
  "kind": "captured",
  "fidelity": "per-request",
  "recordId": "530538b195bba5cd665606c1596ff52ed7d9b7dd561ce9c4780caec3f1b98e35",
  "idempotencyKey": "attr-d01-session-d-per-request",
  "provenance": {
    "cli": "claude-code",
    "cliVersion": "2.1.4",
    "captureChannel": "own-record-tail",
    "formatFingerprint": "sha256:00000000000000000000000000000000"
  },
  "identity": {
    "sessionId": "d01-session-d",
    "parentSessionId": null,
    "agentId": null,
    "projectRoot": "unknown"
  },
  "timing": {
    "requestInstant": "2026-06-03T10:00:00.000Z",
    "captureInstant": "2026-06-03T10:00:01.000Z"
  },
  "modelId": "claude-sonnet-5",
  "interaction": "user-turn",
  "tokens": {
    "netInput": 50,
    "cacheRead": 0,
    "cacheWrite": 0,
    "output": 0,
    "reasoning": 0
  },
  "raw": {
    "vendor": "test-fixture",
    "usage": {
      "input_tokens": 50,
      "output_tokens": 0
    }
  },
  "rawStatus": "complete"
}
