{
  "schemaVersion": "1.0.0",
  "kind": "captured",
  "fidelity": "session-cumulative",
  "recordId": "1603cc8d91232964710b75d946d002f36ff54ebe0c74425ea41eb516c3da7068",
  "idempotencyKey": "attr-d01-session-a-sc-1",
  "provenance": {
    "cli": "claude-code",
    "cliVersion": "2.1.4",
    "captureChannel": "own-record-tail",
    "formatFingerprint": "sha256:00000000000000000000000000000000"
  },
  "identity": {
    "sessionId": "d01-session-a",
    "parentSessionId": null,
    "agentId": null,
    "projectRoot": "unknown"
  },
  "timing": {
    "requestInstant": "2026-05-10T10:00:00.000Z",
    "captureInstant": "2026-05-10T10:00:01.000Z"
  },
  "modelId": "claude-sonnet-5",
  "interaction": "user-turn",
  "tokens": {
    "netInput": 100,
    "cacheRead": 0,
    "cacheWrite": 0,
    "output": 0,
    "reasoning": 0
  },
  "raw": {
    "vendor": "test-fixture",
    "usage": {
      "input_tokens": 100,
      "output_tokens": 0
    }
  },
  "rawStatus": "complete"
}
