{
  "schemaVersion": "1.0.0",
  "kind": "captured",
  "fidelity": "per-request",
  "recordId": "de186b14eed88079447621c430825c3cb305298d7ebfdb9b300ac5d15fc9c920",
  "idempotencyKey": "attr-prune-nostore-key",
  "provenance": {
    "cli": "claude-code",
    "cliVersion": "2.1.4",
    "captureChannel": "own-record-tail",
    "formatFingerprint": "sha256:00000000000000000000000000000000"
  },
  "identity": {
    "sessionId": "attr-prune-nostore-session",
    "parentSessionId": null,
    "agentId": null,
    "projectRoot": "unknown"
  },
  "timing": {
    "requestInstant": "2024-09-16T09:00:00.000Z",
    "captureInstant": "2024-09-16T09:00:00.000Z"
  },
  "modelId": "claude-sonnet-5",
  "interaction": "user-turn",
  "tokens": {
    "netInput": 100,
    "cacheRead": 0,
    "cacheWrite": 0,
    "output": 50,
    "reasoning": 0
  },
  "raw": {
    "vendor": "test-fixture",
    "usage": {
      "input_tokens": 100,
      "output_tokens": 50
    }
  },
  "rawStatus": "complete"
}
