{
  "schemaVersion": "1.0.0",
  "kind": "captured",
  "fidelity": "session-cumulative",
  "recordId": "43b354e89752231cfd3d6e748be6605ca6e46c97ccab83c55838569f1be8efd1",
  "idempotencyKey": "r05-s1-cum-500",
  "provenance": {
    "cli": "claude-code",
    "cliVersion": "1.0.0",
    "captureChannel": "test-fixture",
    "formatFingerprint": "sha256:00000000000000000000000000000000"
  },
  "identity": {
    "sessionId": "sess-s1",
    "parentSessionId": null,
    "agentId": null,
    "projectRoot": "/home/agent/SENTINEL-PROJECT-ROOT-51d2"
  },
  "timing": {
    "requestInstant": "2026-09-21T08:00:00.000Z",
    "captureInstant": "2026-09-21T08:00:00.000Z"
  },
  "modelId": "claude-sonnet-5",
  "interaction": "user-turn",
  "tokens": {
    "netInput": 500,
    "cacheRead": 0,
    "cacheWrite": 0,
    "output": 50,
    "reasoning": 0
  },
  "raw": {
    "vendor": "test-fixture",
    "usage": {},
    "transcriptExcerpt": "SENTINEL-CONVERSATION-TEXT-7f3a9c"
  },
  "rawStatus": "complete",
  "attribution": {
    "taskHandoffKey": "task-mixed"
  }
}
