{
  "schemaVersion": "1.0.0",
  "kind": "captured",
  "fidelity": "per-request",
  "recordId": "94980a367ec8f2418119cc3290899597c2f23b5edfbbbc48bcc1b41e23413263",
  "idempotencyKey": "r12-unpriced",
  "provenance": {
    "cli": "claude-code",
    "cliVersion": "1.0.0",
    "captureChannel": "test-fixture",
    "formatFingerprint": "sha256:00000000000000000000000000000000"
  },
  "identity": {
    "sessionId": "sess-gaps",
    "parentSessionId": null,
    "agentId": null,
    "projectRoot": "/home/agent/SENTINEL-PROJECT-ROOT-51d2"
  },
  "timing": {
    "requestInstant": "2026-10-07T10:00:00.000Z",
    "captureInstant": "2026-10-07T10:00:00.000Z"
  },
  "modelId": "vendorless-model-zz",
  "interaction": "user-turn",
  "tokens": {
    "netInput": 50,
    "cacheRead": 0,
    "cacheWrite": 0,
    "output": 5,
    "reasoning": 0
  },
  "raw": {
    "vendor": "test-fixture",
    "usage": {},
    "transcriptExcerpt": "SENTINEL-CONVERSATION-TEXT-7f3a9c"
  },
  "rawStatus": "complete"
}
